key,text
Neil Barman,"Chief Growth Officer | Board Observer | Growth-hacker | Storyteller | Early stage Investor| ***Always Hiring Sales Rockstars*** I have 2 decades of experience in Saas and direct-to-customer sales and marketing processes. With business leadership experience in managing sales, marketing and account management functions in IT Services or IT products environment. I have deep understanding of building sales and revenue generation functions in start-ups and scaling organisations across industries and regions. Apart from leading the Growth function globally for Yellow.ai, I am one of the founding members of Sales Enablement society in India and Malaysia, Ambassador for Future Of Sales - APAC community, Advisory Board member to multiple start-ups in India, Malaysia and US and Mentor to the Entrepreneurship cell of BITS Pilani India. Spearheading the growth function for Yellow Messenger globally. Building sales and customer success team to diversify into newer territories and domains. Managing a highly effective network of channel patners, ranging from large SI's to mid-size re seller network across the region. Currently leading all growth function teams including sales, account management, inside sales and partner management. Spearheading the growth function for Yellow Messenger globally. Building sales and customer success team to diversify into newer territories and domains. Managing a highly effective network of channel patners, ranging from large SI's to mid-size re seller network across the region. Currently leading all growth function teams including sales, account management, inside sales and partner management. The Sales Enablement Society (SES) is a volunteer organization focused on elevating the role of Sales Enablement in organizations worldwide through engagement, communication, research, and development. We are the first non-profit Sales Enablement community of Malaysia. Founded in 2016 in the United States, with five founding members, the SES has grown to more than 2,500 members in 13 countries with chapters across the globe. Members represent all areas of the sales enablement community – practitioners, suppliers, industry experts, and academics. The Sales Enablement Society is a volunteer organization founded in January 2016, by a diverse group of like-minded sales and marketing professionals based in the Washington, D.C. area. The SES's overall mission identifies best practices for successful outcomes, clarifies the operations for the sales enablement business, and develops the criteria for sales enablement roles within successful organizations."
Neil Barman + Education,"Chief Growth Officer | Board Observer | Growth-hacker | Storyteller | Early stage Investor| ***Always Hiring Sales Rockstars*** I have 2 decades of experience in Saas and direct-to-customer sales and marketing processes. With business leadership experience in managing sales, marketing and account management functions in IT Services or IT products environment. I have deep understanding of building sales and revenue generation functions in start-ups and scaling organisations across industries and regions. Apart from leading the Growth function globally for Yellow.ai, I am one of the founding members of Sales Enablement society in India and Malaysia, Ambassador for Future Of Sales - APAC community, Advisory Board member to multiple start-ups in India, Malaysia and US and Mentor to the Entrepreneurship cell of BITS Pilani India. Spearheading the growth function for Yellow Messenger globally. Building sales and customer success team to diversify into newer territories and domains. Managing a highly effective network of channel patners, ranging from large SI's to mid-size re seller network across the region. Currently leading all growth function teams including sales, account management, inside sales and partner management. Spearheading the growth function for Yellow Messenger globally. Building sales and customer success team to diversify into newer territories and domains. Managing a highly effective network of channel patners, ranging from large SI's to mid-size re seller network across the region. Currently leading all growth function teams including sales, account management, inside sales and partner management. The Sales Enablement Society (SES) is a volunteer organization focused on elevating the role of Sales Enablement in organizations worldwide through engagement, communication, research, and development. We are the first non-profit Sales Enablement community of Malaysia. Founded in 2016 in the United States, with five founding members, the SES has grown to more than 2,500 members in 13 countries with chapters across the globe. Members represent all areas of the sales enablement community – practitioners, suppliers, industry experts, and academics. The Sales Enablement Society is a volunteer organization founded in January 2016, by a diverse group of like-minded sales and marketing professionals based in the Washington, D.C. area. The SES's overall mission identifies best practices for successful outcomes, clarifies the operations for the sales enablement business, and develops the criteria for sales enablement roles within successful organizations. Hard working and efficient in attitude. Possess thirst for knowledge and likes to work under challenging situations. Innovative working attitude. Believes that market is the institution where society comes for satisfying its wants and needs, so in today’s world of Globalize market, providing best customer-service and attaining customer’s satisfaction is the key to success in this huge platform of competition. Ambitious to sharpen skills more in the field of Business Delivery and Client Relations and expertise in the skill."
Paras Chopra + Wingify (1 LinkedIn data),"- Founder and Chairman of Wingify, a tech company with 2500+ clients in over 90 countries for its main product VWO, the market-leading A/B testing software- Proudly bootstrapped the growth of Wingify to $25mn annual revenue without raising any investment- Forbes India 30 under 30 and Forbes Asia 30 under 30- Winner of Economic Times Startup of the Year award in 2017- Gold medalist from Delhi College of Engineering, Delhi University- Published multiple research papers in international peer-reviewed journals in computational biology. Wingify is a leading SaaS company in customer experience and conversion rate optimization space. With 2500+ paying clients globally, the company has the following products: 1. VWO Testing, an A/B, Split, and Multivariate Testing solution 2. VWO Engage, a push notification service for web and mobile 3. VWO Insights, a visitor behaviour tracking & analytics product 4. VWO FullStack, a server side testing solution 5. VWO Plan, a program management layer for experience optimization Proudly bootstrapped, Wingify has 250+ employees across India (we're remote!) and has a sales of more than USD 25 million annually. My job was to analyze and devise Artificial Intelligence and Machine Learning algorithms for enabling accurate large scale assessment via standardized Computer Adaptive Tests. Techniques used include Bayesian inference, active learning, non-linear optimization and various classification, data mining and predictive analytics methods. Leading a team of six people, I am successfully managing Kroomsa which helps Indian bands promote their music on the web. A win-win model has been created as the revenue generated through the website is shared between the artist/band, Kroomsa and an NGO. I was part of the Life Sciences group in Grail Research. As an Analyst, my job responsibility was to tackle a business research problem and come up with relevant data and insights through primary and secondary research"
Phani Yedavilli,"VP Product Partnerships, yellow.ai | Product & Growth | IIT Kharagpur Leadership experience in Consumer Internet & SaaS startups with deep understanding of e-commerce and technology businesses. Worked on scaling up mature categories and demonstrated expertise in building from ""0 to 1"". Initiative driven & a strong believer of first-principles and have exhibited the ability to deliver complex challenges. Areas of expertise: strategic partnerships, P&L Management, business strategy, negotiations, investments and growth initiatives. Passionate about the internet economy & the innovations in the consumer & enterprise tech space in India. Looking forward to collaborating with companies, exciting startups. Reach out to me on phani.y@yellow.ai Worked in a leadership role creating impact in P&L & Working Capital Management, Distribution & Growth and Strategic initiatives - Strategised and executed the overall P&L ($30 mn annualised GMV) and cash flow management with a consistent track record of achieving top-line & bottom-line goals. - Evaluated, negotiated & successfully operationalised 100+ national partnerships with fulfilment partners, banks, payment partners, OEMs, marketing affiliates, logistics partners & technology vendors - Devised unique GTM partnerships with 8+ Banks (HDFC,ICICI,IDBI,YES,Federal,etc), OEMs (Karbonn,Intex, Infinix) and Offline Distribution Networks to deliver multifold inorganic growth - Led strategic projects to improve unit economics and undertook initiatives to drive cost optimisations across various business units Worked across various verticals – Operations, Growth & Hiring. Led the growth & expansion activity across Bangalore - Spearheaded B2B tie-ups with companies and closed deals which contributed to 30% of the revenue - Conceptualised and implemented BTL activations, Content Marketing, Acquisition & Retention strategies - Expanded operations to 11 new locations, spearheaded the launch of dinner category which led to a 100% increase in revenue - Built the operations dashboard, clustering algorithm & delivery boy mobile app which lead to 15% increase in efficiency Received appraisal in 6 months and was promoted to work in a high activity & high profile offshore location. Was in the team which accomplished exploration operations with ticket sizes over 1.5 mn USD. • Led multi-national teams to accomplish high profile reservoir evaluation operations with zero loss-time, zero incidents and best service quality. • Responsible for client relations, pre-job planning & preparation, safety evaluation, resource identification & utilization, logistics management, job execution, data evaluation & quality checks and on-site troubleshooting activities. • Was actively involved in reporting, raising red flags, mitigating risks & taking initiatives towards delivering the best of service quality to the clients. • Worked consistently towards training of the crew and as reporting manager, was responsible for the appraisal & promotions of operators & technicians. Received technical training in Abu Dhabi followed by on-field training at Agartala. Was actively involved in all the aspects of the operations - job logistics, inventory management, crew handling & data delivery. • Maintained the tracking of assets worth over $400K including radioactive sources & explosives. • Streamlined the inventory management, invoicing & calibration updation processes in the newly established base. • Led the Loss Prevention Team in Agartala, catered to the QHSE (Quality Health Safety Environment) requirements of the newly established base. • Successfully completed PEPTEC-1 course with an aggregate of 82% from MLC, Abudhabi • Selected for the Finance panel at the 21st edition of the HPAIR Asia Conference held in Dubai • Participated in seminars, case studies and workshops focusing on challenges and collaborative growth of Asian economies"
Prashant Pandey,"Head of Engineering @ Asana - We're hiring! asana.com/jobs. I lead the amazing engineering team that builds Asana. We are growing the team fast in San Francisco, New York, Reykjavik and Vancouver. If you are interested in joining a fast-moving startup that's changing the way teams collaborate please visit asana.com/jobs. Asana is a leading work management platform, helping more than 60,000 organizations and millions of users across 195 countries organize and manage all of their work, including AB-InBev, Airbnb, Disney, KLM Air France, NASA, Uber and Vox Media. Asana has been named a Top 5 Best Place to Work by FORTUNE three years in a row, and one of Glassdoor’s and Inc.’s Best Places to Work. Headquartered in San Francisco with offices in New York, Dublin, Sydney, Vancouver, and Reykjavic, Asana is always looking for curious, collaborative people to be a part of our inclusive culture and help us achieve our mission. Bootstrapped the DynamoDB team in Palo Alto. Led the development of several key features including global secondary indexes, fine-grained access control, parallel scan, query filters and DynamoDB Local. Recruited and mentored a team of 20+ engineers. My team was responsible for architecting, implementing and operating Vdopia's video and rich-media advertising platform. Led the development of ad serving, real-time monitoring/optimization, data aggregation, client libraries (iOS, Android, Flash, HTML), and publisher/advertiser/operations portals. Selected as 2010 Fellow, Completed 9-month entrepreneurship mentoring program. Several roles and projects touching different products, summarized below. Senior Software Engineer [Jun 2007 - Dec 2009]: - Storage for Cloud Computing - Led a team in creating a prototype of the Hadoop MapReduce system running on a POSIX cluster filesystem. Analyzed the architecture choices for the storage layer needed for a cloud computing platform. - Distributed RAID-6 design - Designed a distributed RAID protocol that can be implemented on a commodity-cluster based storage system.Advisory Software Engineer [July 2003 - Jun 2007]: - Server-Storage integration -- Led several sub-projects to utilize server virtualization to integrate applications into storage servers - Storage Performance management -- Developed technology to provide stream-based performance guarantees in multiple storage products. - Aurora: Autonomic Storage management -- Technical lead of Extreme Blue project. Staff Software Engineer [Oct 2001 - July 2003]: - Storage Performance management -- Developed technology to provide stream-based performance guarantees in multiple storage products."
Prashanth GJ,"Building TechnoBind - A Distributor with a difference !!!!! An award winning, innovative Senior Sales & Business management executive with over 20 years of progressive leadership experience in different dimensions of information technology including Software & Hardware spanning across End Points, Server, Storage, Security and Virtualization domains. Demonstrated results across various roles in driving direct account & enterprise sales, channel sales and general management with global organizations. Inclusive experience in successfully building & turning around business, enabling technology & solution sales; through strong techno-commercial skills, collaborative teamwork, relationships with business partners, channels & customers. Learned valuable lessons while leading businesses across diverse cultures & through different economic environments. Core skills: 1. Leadership: Track record of attracting, coaching, developing and retaining top talent in competitive job markets. Passion for organization development. 2. Market entry & development: Experience developing and ramping up customer bases. 3. Business expansion: Successfully grown Revenues and profits. Extensive P&L management experience. 4. Hands on – Number Driven, Sales Management across Enterprise, Commercial and SMB/Channel Honored with various awards, recognitions & promotions for demonstrating exceptional commitment & outstanding performance – Pinnacle Club, President’s Club, Achievers’. Utilizing industry knowledge and understanding of the market, the TechnoBind business model was created to don the role of a Specialist Distributor focussing in Data Management Domain. The basic business model was to build a strong channel eco-system enabling partners to deliver best in class solutions for their customers through niche and emerging technologies, there by showcasing better and higher value for them. We build the marketing, channel recruitment and direct sales organization for the technology providers that are required to drive the revenue plan in the country. • Created the business model o Idea, Purpose, Getting Started, GTM Definition, Building team, Raising Money • Build and Execute strategy related to – Organisational Development, Market Development, Revenue Plan • Developed the relationships to drive the business model o Alliance Partners o Channel Partners o Financial and Commercial Partners • Provide high level guidelines around our business practices and processes, develop and monitor metrics to measure our performance indicators *Part of the India Leadership Team *Responsible for the West and then South Region Business of Symantec *Build, lead & leverage high-caliber sales organizations through mentoring, problem solving & motivation *Active Management of the Enterprise, Commercial and SMB Teams *Conceptualise, Strategise and Drive Multi-Million Dollar Deals in Select Enterprise Accounts *Program Driven approach to drive SMB Run-Rate numbers *Manage Channel Capacity-Capability Mix for each region *Market expansion & competition handling * General management, strategy, planning, sales and operations. * Managing Revenue Plan, Profitability and Market share for the Region. * Part of the Leadership Team for designing and executing the country’s growth plan. * Executive sponsor for select Large accounts – existing and competition. ?* Build a High-Performance Team in the Region ? Responsible for leading the Enterprise Sales Team to manage the Key Customer Base of NetApp in the region (South & SriLanka) and expand into new segments. ? To ensure that the Business Strategies in the region are aligned with the Business Dynamics in the region. ? To ensure Business Planning, tracking and reporting are accurate and timely. ? Acquired, retained and managed key accounts and marketed the complete range of Compaq & HP products and services. ? Monitored for product and service delivery and coordinated with multiple internal departments/ teams to enable a pleasant customer experience with the organisation."
