key,text
Bhavana Issar + Caregiver Saathi (Headline + About + JD),"Dignifying Care-related Work & Valuing Emotional Labour to unlock the potential of Women ? Founder CEO: Caregiver Saathi I HR - OD Consultant: Sambhaavna I Coach I Speaker I Motorcyclist I Limca record holder Care related work is the invisible engine of economy and the very essence of human existence. Over the years this aspect of life has been relegated to gendered roles in across communities and cultures. As we build a world of gender equality, it is imperative that we account for the care-related work that goes unnoticed and undervalued. Caregiver Saathi is an attempt to institutionalize care-related work and value its contribution in building an inclusive world. It is also the ikigai for Bhavana as it is at the intersection of her life experience, professional and academic qualifications and dreams. Bhavana comes with nearly 25+ years of experience in diverse global companies as a consultant, an HR leader and a passionate person with diverse interests. She brings practical experience of accomplishments inside organisations along with a depth of professional knowledge, which she continues to challenge and build. She is the Founder & CEO Sambhaavna (www.sambhaavna.com), a business consulting firm and Caregiver Saathi (www.caregiversaathi.co.in) , a social enterprise that aims to create an ecosystem of well-being for the informal caregivers who are the primary caregivers to a family member with terminally illness or with chronic medical conditions. Additionally, she is Fellow and practicing facilitator in Process Work & OD Practitioner with Sumedhas Academy for Human Context (www.sumedhas.org ) Global Ambassador for Global Moto Adventures (www.globalmotoadv.com), a platform that supports women motorcyclists to achieve their dreams.Visiting faculty at Indian Institute for Management, Ahmedabad (www.iima.ac.in)She believes that we thrive in organizations or spaces that are co-created, trusting, gently challenging with honest and direct communication. Such spaces are the bedrock for multiple perspectives and only when there are multiple and diverse perspectives, can we inspire new possibilities (“Sambhaavna” in Sanskrit/Hindi).Being a motorcycle rider has helped her discover herself by pushing the boundaries of mind, body and soul and creating new possibilities, something she passionately believes in and wishes to live. While there are many ways of describing her - from a romantic poet to a relentless activist, what she relates to the most, is curious learner and an adventurous explorer. Caregiver Saathi (www.caregiversaathi.co.in) is an endeavour to acknowledge and support Caregivers of patients with terminal illness or chronic conditions, so that together we can improve the quality of their lives, their well-being and those that they care for.Saathi is Hindi for “companion” and we believe caregivers of terminally ill patients need a friend who understands, supports and is there for them as they walk along the difficult path of supporting their loved ones.There are many ways in which a caregiver is challenged and often the caregiver also needs care, emotional support, understanding, easy access to information, guidance from experts and wisdom from others who have similar experiences. It is our endeavour to bring it all together and make it easy access for the caregiver.We want to create an integrated ecosystem of well-being for those family members who are primary caregivers to their dear ones battling chronic medical conditions or terminal illness. We partner with doctors, health practitioners, employers and well-wishers of caregivers to build a supportive community for the caregivers. www.caregiversaathi.co.in At Sambhaavna (www.sambhaavna.com) we are passionate about working with individuals, teams and organisations, who want to change, grow and make a difference. It is particularly gratifying for me to visualize change and and then see it manifest, both at the individual and at the organization level. With over 20 years of experience in diverse global companies either as an HR leader or as a consultant and coach, I bring practical experience of accomplishments inside organisations along with a depth of professional knowledge which I continue to develop.While there are many ways of describing me - ranging from a romantic poet to a cynical activist, what I would relate to the most would be a curious learner and an adventurous biker.I believe we thrive in organizations or spaces that are co-created, trusting, gently challenging with honest and direct communication. Such spaces are the bedrock for multiple perspectives and only when there are multiple and diverse perspectives, can we create new possibilities (“Sambhaavna” in Sanskrit/Hindi).Currently, I partner with organizations in the areas of Strategic Human Resources, Organization Development, Capability Building and Talent Management. My areas of interest include Change and transitions, Innovation, Creative expression, group dynamics and transpersonal psychology.There are many customised ways in which we partner with organizations ranging from long-term agreements (12-36 months) for change as a part of organization development to short-term project-based interventions (5-6 workshops) for capability building, leadership development or results-based executive coaching (9-18 months). As a member of a network of associates, we partner with other OD consultants to service the needs of the organizations.As an Entrepreneur, I run a social organization called Caregiver Saathi which provides support and wellbeing to caregivers of family members who are terminally ill or have chronic conditions."
Dhiren Shah,"Global Head of Securities Settlements Platform and Lead Architect for Operations Technology WHAT I DO: I help global organizations build and scale global technology teams that innovate solutions to improve enterprise architecture, while providing strategic technology guidance and governance. I’m known for effective leadership in the areas of relationship development, technology management, roadmapping, implementation, and team building. WHAT MAKES ME DIFFERENT: I have demonstrated organizational value through earned promotions and carefully cultivated career progression, driving consistent, diligent results for leading organizations including AT&T, Merrill Lynch and Morgan Stanley. From my time as a hands-on programmer to most recently managing a large global development team of 250 developers to deliver 60+ projects, and oversee portfolio of 83 applications; weilding a budget of $30M and supporting 2000+ global users. My experiences coupled with my natural abilities in communications, training, and team management allows me to add immediate and measurable value towards global strategic goals. READY TO TALK? Reach out to me directly here on LinkedIn. SPECIALITIES Technology Management | Operational Leadership | Strategic Architectural Design & Planning | Enterprise and Digital Architecture | | Services Oriented Architecture | IT Spend Optimization | Team Leadership | Roadmap Definition | Stakeholder Management | Analysis | Data Management | Negotiation | Risk Management | Vendor Negotiation | Project Management | Process Improvement | Relationship Management | Stakeholder Management | Budgeting | Forecasting | Project Analysis | Presentation | Project Delivery | Training | Performance Management WHAT I DO : Global Head of Securities Settlements Platform and Lead Architect for Operations Technology WHAT I ACHIEVED: Leading the global organization through multiple transformations, while creating the next generation of industry leading Securities Settlements Platform. Parallel transformations include - Creation of a single cloud native platform on Azure - Adoption of Agile @ Scale with 16 squads - Managing skill transformation and creating independent squads with required capabilities -Creating emergent architecture to expedite time to market and optimize current portfolio -Creating blue prints for cloud adoption and driving strategic transformation across operations technology - KPIs targeted by the transformations include o Business Enablement – create new revenue channels o Lower risks and increased controls o Improved end user efficiency o Reduction in TCO o Improved Inventory Management & Reduction in Fails o Lower Funding Costs o Developer Productivity o Time to deliver an incremental feature WHAT I DO: Lead Architect and Global Development Manager. Finance Strategic Architecture and Product Control IT WHAT I ACHIEVED: - Introducing Data Management techniques to curate value from data assets and create a foundation for creating Data as a Service for enabling self-service data analytics platform. Looking at machine learning-based tools to discover, curate and organize data for effective sharing of dataset and insights within the data analyst community. - Successfully led the development and completion of a multi-year FED mandated detailed sub-ledger program driving finance to risk integration - Transformed development organization to successfully adopt Agile and DevOps practices WHAT I DO: Architect and Development Manager for Balance Sheet Usage & Optimization application WHAT I ACHIEVED - Managed a global team of 35 developers for implementation of the Phoenix Funding system, a strategic platform for providing business performance metrics to senior management. The application creates desk level balance sheets by modeling highlevel business processes and creating internal transactions. This is a highly complex application processing huge volumes of data (~500MM Journals a day) and implementing 70+ calculations. - Managing a global team of 35 developers for implementation of the system. Phoenix project is the pillar for transforming the institutional securities business in the new regulatory environment and is the foundation of Finance Strategic Architecture. WHAT I DO: Chief Technology Office for US Operations. WHAT I ACHIEVED: - Financial Technologies has a vast array of STP-ready products for securities processing, covering front-office, middle-office and back-office functions of equities, futures &amp; options, fixed income, commodities &amp; money markets. - Identified and bridged functionality gaps and changing architecture to ready the products for the US markets. - Was also involved in evaluating emerging technologies and leveraging them to improve and ready the product offerings for global markets. WHAT I DO: Vice President & Development Manager, Enterprise Data Management team WHAT I ACHIEVED: - P&amp; B Renovation - Designed logical &amp; physical design of the Operational Data Store for event-driven multi-asset class Positions &amp; Balances system (Libra). - Leveraged data exploration tools to understand the usage &amp; statistics of current data elements. The new system implements re-engineered business processes to support a globally available, 7 x 24 STP environment. - Evaluated technologies and successfully implemented commissions data warehouse Implemented a Data Mart for Military Segment of the marketing group. The data mart is being developed using Sybase IQ, Microsoft SqlServer, Net Dynamics and Cold Fusion. End-users will have access to the data mart through intranet and will be able to analyze data using multiple dimensions (for Data Mining, Identifying usage patterns etc.). SeagateInfo & custom ColdFusion apps are developed to provide OLAP & Reporting functionality. Also implemented a spohistioated data warehouse for US Travelers usage details using RedBrick Data warehouse 5.1 and Cognos. This involved implementing algorithms to determine trip level metrics. Managed development of Dynamic Mosaic, a financial modeling tool to identify the best mix of connectivity options and geography for AT&T to enter the local services market considering the capital and EBIT constraints. Mosaic provides a What / If scenario analysis tool. Managed the development of Integrated Business Management System for AT&T Labs, IBMS consists of Sales Funnel, Project Tracking, Time Processing, Expense Processing, Financial Reporting and Billing modules. Responsible for Analysis & Design and business processes reengineering and aligning internal IT with business strategy. Was responsible for analyis and design the system. Enterprise automates all the customer services related activities i. e. Customer Service Agreements, Inventory of Supplies, Fault Management, Billing, Provisioning etc. The system has a distributed Client/Server architecture with a Wollongong LAN on the Client with MS Windows front-end. The server has 2 tiered architecture, with Sun Workstations. The Client/Server communication is done using RPC protocol and Netwise RPC tool is used to accomplish this. The data is distributed using DbVista on the Client platform and Oracle on the Server platform. Lead a team of 5 programmers in the design and development of the Fault Management module of the system utilizing an Application Construction Environment tool we developed allowing event / method mapping for client windows. Organization"
Hemant Ramnani,"Enterprise Sales Leader at Zendesk. Leadership: Love building sales teams, mentoring and coaching them, and partner with sales team members to help them exceed their revenue goals. Entrepreneurship: Product Management, Technology, Finance, Legal, Investors, Prospects, Customers, Team and more - it keeps getting better day by day. Partnership: Creating a clear partnership value proposition and building a business around the same. Leading a team globally to make this happen. Sales: Selling software product and solution development services to ISVs and Enterprises that can eventually help them increase their revenue, margins and brand. Account Management and Program Management: Previously led teams from a technical and management perspective. Primary point of contact for the customer - both offshore and onsite. Development: Experience in development of solutions and products in the Identity Management space. Specialties: Databases, Identity Management, Social Networking, Search engines, data warehousing, data mining, SaaS/Cloud, Social Media, mobility, low code platforms, robotic process automation and more. Leading sales for Zendesk Sunshine Conversations platform - AMER region. Zendesk is a service-first CRM company that builds support, sales, and customer engagement software designed to foster better customer relationships. Zendesk Sunshine Conversations is a messaging platform that empowers businesses to have more personal conversations with their customers by giving every team the same view of the ongoing conversation and the ability to engage with customers on any channel, be it for sales, service or marketing. Led a sales team of 8 people - hunting and farming responsibility. We are responsible for for Intelligent Business Automation (BPM, Low-code, AI/ML) and Security horizontal lines. Led a team of 8 people - hunting and farming responsibility. Helping enterprises increase revenue, improve margins and create a world class brand by transforming the way they digitally transact with their customers, engage with employees proactively and treat suppliers and vendors as an extension of their team. Leading west coast sales for DxContinuum - a sales analytics company powered by AI / ML for predictive sales forecasting as well as opportunity scoring and product recommendations (cross sell). Part of the US Platform sales team at salesforce.com. Help enterprises solve their business and technology problems using salesforce.com's platform offerings."
Sanjiv Anand,"Chairman, Cedar Management Consulting International Chairman, IBS Intelligence, a Cedar venture With over 30 years of global management consulting experience, Sanjiv started his career in the US, where for over 7 years, he developed strategy for US telecom and electronic markets. Subsequently he set up operations in Asia and the Middle East . He has assisted Boards and CEOs of global and regional firms, develop and execute business strategy, transform business operations and address strategic HR and restructuring challenges. He is an international expert on the Balanced Scorecard, having executed over 300 scorecards. Sanjiv has driven over $4 billion of FDI into Asia and assisted private equity firms in over $1 Billion in investments. Well published (BusinessIndia, Gulf News), Sanjiv has been a key note speaker at global conferences. He has been a member of the Stern Alumni Council in New York, and is the President of the Stern India Alumni Group. He has been a Special Invitee to the Board of Governors of Malaviya National Institute of Technology, one of India's leading technology institutes. Sanjiv is a Former Chapter Chair of the World Presidents Organization (WPO) and YPO, and the Doing Business with India YPO Network. His first book published by McGraw Hill titled ""Unlocking Human Capital to Drive Performance: A CEO's Handbook has been a best-seller. His most recent book titled ""Execution Excellence: Making Strategy Work using the Balanced Scorecard"" is about to be published globally by J.Wiley. Sanjiv has identified the top 20 strategic and operational answers to managing human capital at the CEO level, right from recruiting, executive compensation, culture, succession planning, and managing the board on these issues. The book with its many satirical illustrations is designed to make the topic an easy read. Specialties: 1. Corporate and Divisional Strategy. 2. Strategy deployment and enterprise performance management using the Balanced Scorecard 3. Business and Organizational Transformation 4. Global entry strategy 5. Financial Industry and Banking Expert Cedar is a global consulting, research and analytics firm. With over 25 years of experience, Cedar has assisted more than 1000 clients across industry sectors in the formulation of their strategy for the growth and transformation of their business. The company’s heritage in the Balanced Scorecard has enabled rapid implementation of strategy across their customer, process, organizational and business technology framework. Headquartered in the US, Cedar has a network of offices in 15 locations, worldwide. For more information, please visit www.cedar-consulting.com Cedar's research business in the financial services industry operates as IBS Intelligence. For further information please visit www.ibsintelligence.com Renaissance Worldwide acquired Technomic and till 2000, listed on the NASDAQ, headquartered in Boston, Renaissance was a $1 Billion management consulting firm. Rapidly built the India, South Asia management consulting practice in the area of strategy formulation and deployment using the Balanced Scorecard and business transformation. Also played a significant role in the transformation of cellular operators in India in the early days of the very successful Indian telecom growth story. Started the middle east operations in 1999-2000. Continued to assist leading global corporations and private equity funds in their entry of Indian and Asian markets. Set up the India office, and assisted major global corporations like Whirlpool, Emerson Electric, Sara Lee, etc in developing entry strategy for Indian and South Asian markets and assisting in market entry through greenfield, mandamp;a, and joint venture transactions. Started career in Chicago in 1985 as part of the electronics and telecom consulting practice assisting US F500 clients in the development of US corporate and divisional strategy with significant focus on telecom. Played an important roles in assisting ATandamp;T, Bell Labs, GTE, Nortel, Ericsson, and the US bell operating companies transition successfully the new US deregulated markets."
Shuva Mandal,"Managing Partner - Fox Mandal & Associates With more than 30 years of experience as a lawyer, I am currently the Managing Partner at Fox Mandal & Associates. As a corporate & commercial lawyer, I have assisted multiple entities spanning across industry sectors in making Inbound Investments to India and facilitated numerous M&A, Corporate Finance & Private Equity transactions. I have further advised family businesses and HNWIs on setting up a governance structure, restructuring the business, obtaining new investment, and succession planning among other things. I have also supported clients on the disposal of companies, private equity & securities transactions, and public offerings of debt and equity. Other areas of practice include: Real Estate, Employment &amp; Labour, Non-Profit Organisation, Education Specialities: Guidance on Family Business, Business Strategy, Inbound Investment to India, M&A, Corporate Finance, Private Equity & Securities transaction including Real Estate & Infrastructure documentation. Awards: A-List Lawyer by the Indian Business Law Journal I am the Managing Partner at Fox Mandal & Associates, which is a group firm of Fox Mandal, operating in South India. We are an awarded full-service law firm with a pan-India presence and have been in existence for more than 120 years."
Snigdha Singh,"Executive Director at Morgan Stanley A senior technology manager in the institutional finance domain with a strong exposure to Equity Swaps, Equity Derivatives, Delta One and Synthetic products in both front and middle office areas. Have about 20 years of experience in business analysis, architecture, design and delivery of enterprise-scale derivatives systems and programs on a variety of platforms. I have worked on multiple markets from the US to India covering a number of regulatory nuances such as Dodd Frank, EMIR, MiFID and India Tax Regulations. I have helped build and lead high performing, cross regional teams in these areas. Today I lead the India equity swaps team and the swaps STP initiative globally. My team is involved in all areas of the equity swaps life cycle including product creation, trade enrichment, allocation, cash flow, risk and reporting. This includes not just IT stakeholder management but active interactions with the swaps desk and senior business management. Have proven skills in partnering with the business in dealing with the fast changing regulatory and market landscape over the last few years often with rapidly changing requirements and aggressive timelines. Recent external talks: Keynote panelist on the 'Disruptive Technologies' panel at Electronics for You (EFY), Digital Week conference at Bengaluru - Feb 2018 Presentation on 'Blockchain in Financial Services' , EFY Digital Week conference - Feb 2018 Participated as a mentor at R3Roadshow, return to work program, organized by JobsForHer - Jan 2018 Presentation on 'Effective Application Development through Design Thinking Principles' at Grace Hopper Conference -Nov 2017 Panelist on the 'Technology in Finance' panel discussion at Grace Hopper Conference - Dec 2015"
