key,text
Kaushik Chakraborty,"Senior Vice President Digital at Tata Capital | Impact Digital Power 100 | Digital Transformation | Digital Strategy | Marketing | Banking Platform specialist | Digital Product | Fintech. A Sales and Marketing professional with over 20 years of extensive cross-functional experience in digital transformation, strategizing digital road maps, driving online sales and customer service. In my current role I am working as the Vice President-Digital driving the following • Go to market digital strategy for Corporate / SME products • Creating the end-to-end online journeys and assisted journeys for SME customers • API integration with various government data sources and alternate data platforms for better credit decisioning and faster loan disbursements • Creating and maintaining the responsive web portal for the organisation with NLP based chatbot • Building and hosting the website on Adobe Experience Manager, the comprehensive content management solution from the Adobe • Implementing the Adobe and Google Analytics along with other tools on the website and mobile app for tracking, segmenting and targeting the customers to create their personalised journeys • Manage all digital marketing efforts across paid platforms and inbound marketing activities My past organisations include UTI Mutual Fund, Standard Chartered Bank and ICICI Bank where I have worked across Digital, Sales, Service and Project Management roles. My rich and varied experience spans across Consumer Banking, Asset Management and SME Banking spaces during my professional career. I have got more than 10 years extensive experience specifically in driving Digital Transformation, where I have set-up the complete Digital Business for UTI Mutual Fund from zero to an Average Assets Under Management of 20 billion Few select Awards & Recognitions:- 2019 - Mentor at iStarthub India Accelerator 2019 - 100 Smartest Digital Marketing Leaders of 2019 by World Digital Marketing Congress 2019 - Big 40 NBFC Award Winner of 2019 at the World AI BFSI & NBFC Show 2019 - Jury member for the DMA Asia ECHO Awards 2019 - Jury Member at the Drivers of Digital Awards and Summit 2019 2018 - 50 Best Digital Marketing Leaders Awards presented by World Marketing Congress 2017 - 50 Best Digital Marketing Leaders Awards presented by World Marketing Congress 2017 - India’s Greatest CMO for the year 2016 – 2017 by Asia One 2016 - Jury member for the Marketing Innovation Award 2015 - Jury member for the Marketing Innovation Award 2015 - Jury member for the DMA Asia ECHO Awards 2014 - 50 Best Digital Marketing Leaders Awards presented by World Marketing Congress"
Keertana Koduru,"Corporate Communications, Content Management and eLearning. 10 years’ experience in communications, content creation and management for art & culture, travel and tourism, food, fashion and beauty. Looking for new opportunities. • Created eLearning educational materials following the ADDIE model for content development. This includes planning, research, writing, editing, storyboarding and development. • Collaborated with content experts & Subject matter experts from various departments and across functions to ensure quality and accuracy of all training materials and adherence to deadlines. • Developed and/or procured graphics and content to incorporate into e-learning applications. • Responsible for designing, building, and delivering eLearning across a wide variety of topics. • Created scripts/storyboards when planning for a new online learning module or video. • Collaborate with senior team members to design effective and engaging custom learning experiences with compelling course content • Incorporated brand guidelines and usability best practices. • Analyzed and selected the most appropriate strategy, methodologies, and technologies to maximize the internal communication, learning experience and impact. Birthed a baby boy and was a full-time mom. • Developed activity and detail-oriented process maps for all processes including administration, customer relations, sales and marketing, brand strategy, and internal & external communications • Created company policy, guidelines, and daily content for the website and campaigns for social media platforms – Branding, design, strategy, content, scheduling and queries • Engaged with business leaders, department heads and colleagues to generate regular updates, reports through presentations for process demos, documentation, accounts & daily operations • Managed department budgets and negotiated pricing strategy & liaised with infrastructure, applications team, and vendors • Performed UAT to check functionality, usability, security, compatibility, and performance • Optimized SEO using google analytics • Responsible for quality assurance to ensure compliance with brand guidelines • Communicated insights, and future plans to cross-functional team members and management • Assisted in conducting research on products to meet agreed-upon requirements • Content management for the digital platform and social media – schedule, strategy, content & queries • Assisted with SEO management • Liaised with vendors & negotiated pricing strategies • Collaborated with design & marketing teams for AD campaigns • Created content with Adobe Photoshop for website and social media Qatar Tourism Authority: Content writing - culture & tourism The Culture Trip: Content writing on art, culture, travel and tourism AllandAbout.com – Content Manager • Developed content strategy and an editorial calendar – Art, culture, food & Fashion, SEO & social media management"
Kempa Raju,"Data Engineer at Relatas - Sales AI. Experienced Full Stack and Data Engineer with a demonstrated history of working in the computer software industry. Being interested in internals of databases and also skilled in Python, Databases, JavaScript, Java, DS, Algorithms and Web Development. Strong engineering professional with a Bachelor’s Degree focused in Computer Science from PESIT.."
Kiran Nataraj,"Founder and CEO at Entrib Analytics - @ShopWorx. An Entrepreneur who is passionate about problem solving, with 25+ years of experience in software product development. Worked in different technology areas- mobility, telecom and networking and now Industrial Internet of Things (IIoT) as applied to Intelligent Manufacturing ""!. Pivoted Entrib Analytics (my current venture) in late 2014 to focus on the manufacturing shop floor. My techno-commercial background is helping Entrib craft its journey in the Enterprise product space, currently targeting productivity improvement on manufacturing shop floors. Entrib, a leading Industrial IoT Solutions company helps manufacturing companies to remove the guesswork out of the operations by using data from the shop floor. Entrib’s ShopWorx product suite enables seamless gathering of the data from machines, processes and people to provide real-time visibility of the shop floor. ShopWorx uses advanced analytics and machine learning to get most of out of the industrial assets and make the factory a Smart Factory. With solutions for Automotive and Consumer goods manufacturers, ShopWorx is helping companies to move towards Industry 4.0. Entrib is based out of Pune and provides solutions across India, China, Thailand, Singapore, Sri Lanka and other countries."
Komlin Kaur,"Internal Communications Lead at Trellix | Employee Engagement | Crisis Communication | CSR | Media Relations| Analyst Relations | Diversity & Inclusion | Public Relations | External Communications | Content Creation. I'm a communications professional and a storyteller, with close to 15 years of experience in handling External & Internal Communications for global and Fortune 50 organizations. I come from a strong background of both Public Relations & Internal Communications and have been instrumental in developing robust Internal Communications and employee engagement strategies for organizations, thereby creating some of India's Best Workplaces! I've also had the opportunity to work extensively across Executive Communication, Crisis Communications, Analyst Relations, case studies with research organizations, Content development, Newsletters, Corporate Branding, handling relationships with Industry bodies, Advocacy Relationships, Community relations (CSR) and Reputation Management amongst others. I strongly believe that every single thing we do as communicators has an impact on our stakeholders and it takes us two steps closer to what we'd like to achieve. As the Internal Communications Lead for TrelliX, erstwhile, McAfee India, I support an uber talented team of more than 2300 employees across McAfee's India offices. With collaboration being the foundation of everything I do, I've been fortunate to don several hats - that of leading employee communication, supporting our executive team with both internal and external messages that are both humble and impactful, serving as a core member of the CSR team, nurturing our relations with industry bodies and crafting messages for our social media platforms, just to name a few. We are proud of the work we've done here, and have been named amongst the Best Workplaces in India by Great Place to Work, across several categories in the past two years. Since Covid-19, I'm also a part of the Emergency Response Leadership team, that has together done some tremendous work to help employees during these tough times. As the Analyst & influencer Relations Manager, India/South Asia, I was handling Analyst Relations for all of IBM's business across India. My key role was to build and strengthen IBM India's business prerogative with leading analyst firms such as Gartner, Forrester, IDC just to name a few. In this role, I supported all aspects of Business Continuity for the Global Continuity & Resiliency (GCR) team for Target India and across multiple Asia locations. My key responsibilities were to ensure that critical teams across Target India and Sourcing locations had strong business continuity plans. In addition, I also focused on aspects of awareness, training, communication and coordination with these teams. A significant part of this role was to handle crisis communications for locations, which were spread across the APAC region. As a part of this team, we also conducted campaigns which prepared our team members to handle crisis situations (natural disasters, technical failures, outages etc.) In order to be an integral part of this role, to support global communications and gain an in-depth knowledge, I certified myself as an Associate Business Continuity Professional by the Disaster Recovery Institute International in Jan. 2015. As a part of this role, I was fortunate enough to work with a fantastic team of communicators to strategize, execute and lead Internal Comms for Target India. I worked as a part of the external communications team which creates PR plans and strategies to position Target India externally. This involved several facets of external comm. such as media relations, events sponsorship, relationship building with key industry bodies such as NASSCOM, branding opportunities, reputation management, advocate relations, key message and leadership message development and building the employment brand among others. Was responsible for managing clients across verticles such as Retail (corporate and brands), FMCG, Pharma, Venture Capital et. all by means of providing strategic communications, crisis management, client servicing, senior media relations and various other PR tools which lead to a brand's success. Worked on clients such as Arvind Ltd. (corporate and brands which included Flying Machine, US Polo, Arrow, Gant etc), USL, i2India, Bioquest etc Other key competencies included: - 360 degree communication driven approach which would help all the brands succeed in their PR approach - Crisis communication support, documentation for key deliverables, planning and implementation of PR strategy across brands - Client servicing, managing media relations across target cities, strategic approach towards implementation - Extensive documentation which includes press releases, pitch notes, crisis toolkits, Q&As, pitch presentation, new business presentations along with research and creative ideation - Monthly Reviews, Annual Presentations, Quarterly & Monthly plans for all clients. Was responsible for client servicing, media relations and strategically planning & implementing PR activities for various clients. Worked across a diverse set of clients ranging from verticles such as General Insurance, Media & Entertainment, Venture Capital and Private Equity, Micro Finance, FMCG, Pharma, Automobiles amongst others. Some key clients included names such as Discovery Networks India, Bharti AXA General Insurance, CNBC TV18, SIAM, USL Group and IDG Ventures etc"
Krishnakumar Natarajan,"Co Founder Mela Ventures and earlier Co-Founder at Mindtree - Building a Global services and SaaS business -Experience in starting and growing a business - Goals- To build a globally admired companies delivering substantive business impact using Digital technologies. - Using Digital technologies to solve Social problems on scale - Helping create World Class Entrepreneurial teams from India Specialties: Globalization, Building large accounts, Building great teams and leadership Invest and mentor budding entrepreneurs to build scalable and successful businesses. Built complex ecommerce solutions and scaled the business to a $30M revenues - Managing Human resources for the IT business. - Responsible for increasing the team size in software business Selling and servicing Computer hardware and peripherals to customers in Northern India"
Lalit Kumar,"Technology Sales | Digital Transformation | Portfolio Leader. Accomplished leader in Tech. industry with experience across digital transformation, software product engineering, Apps, Infra, Cloud/SaaS & Analytics. Passionate about incubating business, building high-performance sales & account team and driving P&L towards profitable growth. Establish and nurture strategic partnerships with Clients for Tech enablement and support through their digital journey. On educational front, Engineering & MBA graduate from top schools with strong academics. Outside work, I am passionate about writing (published a poetry book) and adventure sports. Specialties: -Sales, Business Development, Strategic partnerships and Go-to-market strategy & execution -Professional services & Customer success -Large Program & account management -Team building, P&L management -Cross-functional Leadership. Lead Digital transformation for portfolio of Tech Products & Platform clients. Focused on Hi-Tech clients esp. ISVs & OEMs. Trianz is next-gen consulting and IT services firm focused on providing digital, cloud, ITSM, security and analytics business solutions. Responsible for a portfolio of clients managing P&L, driving revenue growth and incubating client-centric digital & cloud solutions. Established new relationships, closed multiple deals and opened up new revenue streams."
Maheshwari Kapoor,"Over 19 years of experience in marketing communications - including branding, internal & external communications, marketing operations, account marketing, channel strategy, marketing automation and research. Works closely with the business and marketing leadership to establish a go-to-market strategy and disseminate corporate goals and KRAs to the next level of leaders. Successful track record of building and managing high-performing marketing organizations for large and growing enterprises to drive integrated marketing and demand generation efforts. Hands on experience in SFA and Marketing tools such as Salesforce.com (certified), Marketo, Constant Contact, Oracle Sales Cloud, ExactTarget. -Managing global marketing and demand generation programs -Responsible for partnerships and channel marketing initiatives -Overseeing and facilitating new business development for India region -Develop a marketing strategy for US and APAC -Define goals and metrics to measure the effectiveness of marketing programs -Coordinate with the solutions team and manage proposal responses for strategic bids -Generate awareness of our capabilities and services, and also play an integral role in supporting our sales growth via webinars, email campaigns, events, etc. -Strategize and manage internal and external communication - newsletters, blogs, website, PR, etc. -Enforce brand standards and work with business units to build/enhance the corporate brand -Work closely with senior executives and subject matter experts to develop presentations, whitepapers, solution briefs, videos or other marketing materials that advance thought leadership -Manage PR, analyst relations and customer visits for the region -Oversee SEO and social media marketing efforts -Provide market research support to sales and business units and assist in refining our go-to-market strategy -Collaborate with HR to enhance employee engagement - Responsible for overseeing all operational aspects of marketing campaigns such as webcasts and live marketing events. Over 200 webcasts and 100 events in a year. - Managing distribution of pre and post show reports for webcasts and marketing events that facilitates account marketing and marketing ROI measurement. - Oversee and manage email marketing efforts such as event invite, follow-up, reminder, newsletter, and other eminence material distributions to enhance participation from clients. - Responsible for driving marketing automation efforts – Salesforce.com, Exact Target, Aprimo. - Work closely with the Director of Marketing to build and review marketing budgets and plans. - Create roadmaps for new services and solutions. - Plan and execute marketing campaigns (e-mail, webinars, etc.) to drive new business generation. - Facilitate lead / prospect profiling, segmentation, nurturing and opportunity qualification. - Drive lead generation through marketing tools such as – corporate website, lists, Google AdWords, events and partners. - Manage the editorial panel and produce high quality content (proposals, datasheets, case studies, white papers, web, etc) for internal and external customers. - Devise a communication strategy to facilitate internal and external communication - customer newsletters, teasers for internal campaigns, intranet updates, staff newsletters, inter-departmental communication, etc. - Manage marketing research and sales enablement efforts. - Drive marketing automation efforts – Salesforce.com, Oracle CRM OnDemand, Marketo, etc."
Mangal Pawar,"Head of Customer Engagement & Delivery | MS Dynamics Enthusiast. 18+ yrs of rich experience spanning almost the full breadth of the IT industry, I am an OutSourcing Enthusiast who strongly believes in benefiting from doing things where they can be done the Best. Travelling extensively to Europe & US for understanding customers needs and providing them with optimal solutions for business growth, has widened my perspective on how different customers use Technology as an Essential Differentiator for their businesses. It gives me a big 'High' in partnering with customers and seeing them grow through effective outsourcing initiatives! Trust in the fact that People are key in driving results, helps me maximise the efficiency and productivity of our solutions to deliver across borders & different cultures. A solid focus on deploying the right resources while enabling a light-weight governance process on top, are core ingredients of my success recipe for Delivery Management. Vendor Management, Financial and Operations Management also form parts of my daily working."
Manish Sahni + Linedata,"A digital strategic leader, with 20 years of proven record in driving business value through customer strategy and innovative experience design. History of leveraging existing and emerging technologies, uncovering opportunities, strategies to improve operations, develop leading-edge products. Highly experienced in supporting and defining business process transitions towards lean and agile methodology and delivering fantastic end-to-end experiences.Responsibilities - Innovative business transformation: Strategic program, project road mapping, digital transformation and business process re-engineering. - Lean startup and Agile evangelist; employ Lean UX principles to seek ways for improvements that can make a measurable difference to sales and profits. - Thought Leadership and innovation; trend prediction and realization. - Informative product design with state-of-the-art research: Set up and managed usability lab with Tobii eye-tracking, deep knowledge of all aspects of the User Experience life cycle; UX strategy, usability, qualitative & quantitative user research, information architecture and content development. - Successful at building, managing, and motivating teams. Created and managed user experience competency at three major high-tech companies. - Digital Strategy; 14 years designing, developing, and implementing user experience strategy. Directly involved in supporting in a broad range of areas, such as digital transformation and business process re-engineering and stakeholders management. - Strong track record of high performance in fast-paced environments. Employ Lean UX principles to seek ways for improvements that can make a measurable difference to sales and profits."
Manul Trehan,"Director Sales & Operations, ME & Central Asia. I am an ambitious, solution-focused, and highly accomplished Sales and Operations Director with proven ability to excel in challenging positions within fast-paced industries. My business acumen and ability to identify solutions to complex challenges sets me apart from other managers in my field. I always take a meticulous approach to compliance and am committed to maintaining rigorous quality and safety standards. As a role model, I attain the best productivity from employees and thrive in demanding, time critical environments. I take pride in my ability to establish credible, working relationships within all levels of organizations. I address a variety of challenges and meet organizational goals through my experience in the following areas: • Business Administration • Financial Planning • Problem Solving & Critical Thinking • Change Management • Sales & Marketing • Process Optimization • Team Training & Development Desire to take on challenging new roles with expanding operations I have help progressive positions within this company from Sales Representative to Director of Sales and Operations. Director Sales & Operations (ME & CA) (July 2018 to Present) • Supervised team of six highly-skilled sales professionals; increased revenue by 56% in just one year; closed large value projects and added new channel partners. • Identified and addressed areas of concerns and improvement opportunities; tracked performance and monitored productivity; catapulted efficiency 36%. Director Sales & Operations (Southeast Asia) (January 2017 to June 2018) • Combined sales and support functions to enhance response times; achieved 24 hours TAT for specifications and quotations and four hours for technical support; increased customer satisfaction levels from 60% to 90%. • Regained dormant partners and representatives across Vietnam, Malaysia, and Philippines; earned incremental business Board Director (Gurgaon, Haryana, IN) (June 2015 to December 2016) • As Resident Director, expanded market share and accelerated growth by contracting 20 new channel partners; conquered 18% profit increase. • Spearheaded 35-member cross-functional team across multiple departments and assumed full P&L responsibility; Sales Director (Dec 2010 to May 2015) • Led sales development and achieved annual target for region. • Mentored and developed 22-member sales and operations team; collaborated with 35 channel partners to extend business to North, East, West, and South regions"
