key,text
Suresh Sambandam + Kissflow,"Suresh Sambandam is the Founder & CEO of Kissflow, one of India's top SaaS companies. Kissflow’s products help organisations automate work processes and collaborate to get their work done more effectively. Over 10,000+ customers across 160 countries use Kissflow's suite of products.Suresh is a first-generation, self-made entrepreneur who is passionate about technology and about mentoring other aspiring entrepreneurs. He has three US patents to his credit and featured in 4 books. Suresh is a progressive technology leader who does not regard his employees as mere profitable resources, but as family. Without stopping at just being satisfied with his success, he’s chosen to pay-it-forward very early on. He co-founded SaaSBoomi, Asia’s No.1 & largest SaaS Community and was instrumental in creating the first ever playbook for aspiring SaaS entrepreneurs. He also founded Dream Tamilnadu (DreamTN.org), a policy think-tank that aims at making Tamilnadu a trillion dollar economy. He is constantly inspiring students and professionals to become job creators rather than job seekers, and is driving the youth of Tamilnadu towards mass entrepreneurship."
Sushant Mathur,"Enabling Enterprises hire the Best Tech Talent! HackerRank is a fast growing technical talent community used by programmers to hone their coding skills and by companies to recruit tech talent. It's about SKILL not school. It really is that simple. What school you went to doesn't mean you're a great engineer, it means you went to that school. Hackerrank is here to help organizations identify the best engineering talent by the work product they produce. Simple. You get a high score on a code challenge, you're qualified. Low score - you're not qualified. Simple. Our customers can now look beyond Tier 1 engineering schools or only at top engineering companies and find skilled engineer talent where they current live - everywhere. My primary responsibility includes increasing awareness of our solutions and growing customer base in India and APAC."
Sushma Kaushik,"Partner Aavishkaar Capital | Fintech | Impact Investor| Board Member | Starwood Capital Top 100 Women in Finance-2020 “leading” category; 40 under 40 Alternate Investment professional ; Sushma is an experienced early / early- growth stage investment professional who has led multiple investments and exits across India. She has a decade of investing experience across multi fund cycles at Aavishkaar Capital. She has served on the Boards of multiple companies including Utkarsh Core Invest, Arohan Financial Services, Rangsutra , Desert Artisan Holding (part of Fab India) , Chqbook Neobank etc. She started her investing career in Real Estate acquisitions at Starwood Capital. Super thrilled to get my own swag kit! thanks Chqbook team for adding me to the cult! Vipul Sharma , Rajat Kumar , Mohit, are seriously disrupting the way MSMEs are served! one more happy stakeholder to your list ?? onwards and upwards ?? Excited that Aavishkaar Capital is walking the talk on #climateinvesting. We believe it's a great investment asset to develop for the long term.... Sanchayan Chakraborty Sohit Singh Anand onwards and upwards! #climatechange #cop27 #futureisgreen Look forward to a fun evening of cricket with the cool startup founders in my favourite city! great initiative Ajay Lakhotia and StockGro team! let the game begin! #startupstories #innovation #startupfounders Every capitalist says 'Greed is Good'! till Climate change risks eroding everything one has worked towards...Climate change is real and if we as investors don't do anything about it, we risks losing significant wealth. At Aavishkaar Capital we are constantly innovating on investment products that are relevant for the future. #Impact, #Gender, #climate ..... Sanchayan Chakraborty vineet rai Sohit Singh Anand #climateinvestment #climatechange #cop26 #carbonsequestration #netzerostrategy Onwards and Upwards! Started with Aavishkaar when it had an AUM of $30mn a decade back.... proud to be part of this team who have constantly innovated in identifying the next BIG theme of disruption while positively impacting millions of people! today as a group we manage USD 1.5bn in impact assets and >USD 0.5bn of equity assets! wouldn't have been possible without the support of all our founders and investors! govind singh Baskar Babu Ramachandran Purnima Khandelwal Vikrant Bhagwat Vipul Sharma Rajat Kumar Sumita Ghose Was great to exchange notes on how India is growing from strength to strength....the digitization leading to disruption in traditional sectors like banking, agriculture, health care, energy etc! At Aavishkaar Capital we will be looking to participate in this growth story while creating 10x impact! #inclusivebusiness #agritech #impactinvesting"
Swapnil Amritkar,"COO at Entrib Analytics Technology Private Limited I have more than 22 years of experience in Software development in Telecommunications (Voice and Data), Embedded Systems and Device Drivers having managed and delivered complex projects in these areas. I have been responsible for managing diverse teams across multiple geographies in a dynamic work environment, ramping up teams from scratch and planning & managing budgets.I am also very conversant with complete life cycle of the product development. Specialties: Software development, Program Management, Outsourcing, Hiring Program Manager for Graphics Software development programs. Also managed outsourcing activities for the group. Sr Engineering Manager - Graphics Driver Validation - managing a team of Validation engineers working on Graphics driver focused on Display Technologies. Engineering Manager for the team responsible for Development of WLAN Device driver and Applications. Various positions - Software Developer, Manager, Practice head. In the last position as Group Head - Wireless was responsible for projects for 2 major Telecom equipment manufacturers in the area of Wireless Operations Support Systems (OSS) with a total team size of 275 persons and annual revenue of US$10M+. Have been responsible for Customer interaction, Delivery, Operations and Recruitment. Worked with Sales team to generate new business. Contributed to various Process initiatives in Wipro for ISO / CMM/ SIx Sigma. Software engineer - developing software in the area of Telecom for monitoring telephone exchanges and automated testing of PBX for various features and performance."
Swarup Shastri,General Manager & Global Head of Sales Enablement and Operations. Head of Global Sales Enablement and Operations | Digital Sales Transformation | Customer Relationship Management (CRM ) Thought-Leader | Sales Process Improvement and Excellence | Sales Analytics | Business Development. • Responsible for defining and managing sales process operations and enablement functions for Wipro Technologies globally •Responsible for business process definition & re-engineering for enhancing the sales efficiencies across Wipro global sales force and aligning the functions of sales operations with the overall strategic vision of Wipro to ensure highest level of competitiveness in the market •Responsible for Business Development activities of Oracle ERP solutions and develop an effective selling strategy for each opportunity
Swati Bose,"Senior Technical Writer at Synopsys Inc. Seeking a job in a fast-paced development environment where I can use my broad range of 10+ years of technical writing and e-learning experience in creating written, online and training tools to help customers successfully learn about new software products. Worked on Administration Guide, User Guide and other supported documents. Creating and updating User Guides, Installation Guides, Release Notes and Readme. Tools used: MS Word, MS Office, Adobe Acrobat, Adobe Framemaker, Robohelp and SnagIt. Worked with an Insurance project and TechCom in Infrastructure and Assurance domain. Reviewing and editing Client deliverables using MS Office. Developing User Guides and presentations for end users using MS Office."
Sweta Padia,"Industry Principal at Infosys Digital Experience. Specialties: Total experience of 22+ years across Management Consulting, PreSales Consulting, Program Management functions, Global Delivery, M & A implementation, ERP cloud solutions, Financial processes, Automation & Acceptance testing for Fusion applications. Program Manager in Fusion Program management office at Oracle. Responsibilities include: • Managing acceptance and automation testing for Fusion upgrades/implementations • Initiatives to adopt AI and improve user experience across business processes • Managing Fusion BI initiatives • Business transition from on-premise Oracle e-business financial applications to Oracle Financials & Procurement Cloud in Jan-18 • Business transition to Fusion ERP (Financial and HCM) across global entities of OFSS in July 2012. - Collaborating with business stakeholders (OFSS/Oracle) to provide requirements to Oracle IT team - Leading the OFSS IT team in solution reviews, CRPs, execution of testing and data migration strategy and UATs - Implementation of process alignment/change management initiatives leading to system go-live - Formulating retirement strategy for OFSS IT systems - Managed first OFSS monthly/quarter close using Fusion. Roles and responsibilities: • Managed the IT operations for a global PeopleSoft ERP instance for financial, supply chain and project accounting applications deployed for an employee base of 10,000 staff and implemented across OFSS entities in India, Europe, Americas and Asia Pacific • Successfully managed transition from quarterly financial closing cycle to monthly process to meet management reporting objectives • Successfully automated critical business processes associated with different contracting models and managed roll-out activities across multiple LOBs • Led implementation of dashboards for executive management, business heads, corporate teams and project managers. • Managed staff hiring and nurtured vendor relationships for subcontracting IT services. Roles and responsibilities: • Facilitated the sales effort by enabling it with PeopleSoft value proposition and strategic approach to achieve the regional business objectives and revenue • Worked closely with sales team/alliance partners to respond to RFP’s • Constructed compelling prospect/customer presentations, design custom demonstrations using PeopleSoft financials and project accounting applications/reporting tools for the professional services industry in India. Roles and responsibilities: • Managed PeopleSoft 7.5/8 Maintenance and Support at Goldman Sachs, New York, Apr 2003 - Oct 2003 • Billing/AR functional lead for PeopleSoft 7.5/8 Maintenance and Support at Verizon Inc., New York, Feb 2002 - Dec 2002 Roles and responsibilities: • Functional lead for PeopleSoft 8 Implementation at Sasken Communication Technologies Ltd., Apr 2001 - Dec 2001 • Managed the India Localization of PeopleSoft Finance and Distribution, PeopleSoft Inc., Apr 1999 - Mar 2001 • Implementation lead for customized financial solutions in the packaging and power industry, Jul 1996 - Mar 1999"
Tina Philip,"Accenture Ventures and Open Innovation Management professional with over 9 years of experience in the information technology, mobile and automation industries in the emerging markets. Proven track record in end to end planning, design and execution of strategic projects. Adept at working with multi cultural teams across geographies in large corporations as well as in start-up companies. Led the Market Development & Insights practice for IBM’s BPO business in the Growth Markets, which covered Asia Pacific, Central & Eastern Europe, Middle East & Africa and Latin America. Completed projects related to market analysis, competitive intelligence, market segmentation, new client acquisition and customer needs assessment. Served as the single point of contact for all market insights projects and also supported ongoing deals. Co-founded Elevate Learning Lab, a start-up in the mobile application development and training industry. Led the marketing efforts, shaped overall strategy and handled day-to-day operations. Established relations with corporate customers as well as educational institutions. Interfaced with the marketing and strategy leadership teams of IBM’s Global Process Services (GPS) division in the Growth Markets Unit (GMU) to identify key business priorities. Designed, budgeted and managed several strategic projects aimed at achieving the business goals of the GPS business. Delivered fact based, integrated insights and actionable recommendations to accelerate the growth of IBM GPS in the emerging markets of AP, CEE, MEA and LA. Served as the single point of contact for all market insights projects and queries for GPS in the Growth Markets."
Tucker Heiner,"VP of Sales Operations at HackerRank. - Sales, Marketing, Customer Support, and Partner/Channels CRM and Call Center experience - Proficient with Salesforce.com and Marketo; solid understanding of the Sales, Marketing, and Support lifecycles - Six years experience with product lifecycle in cloud applications - Communicates well across business functions and with technical teams. • Streamline sales systems, tools, and processes to maximize revenue growth and reduce churn • Instrument tracking of KPIs and drive forecast accuracy • Establish data governance models for Customer Account & People Lifecycles, Account Hierarchies & Territories, and Opportunity Pipeline • Oversee Deals Desk and Quote to Order Process. • Owned, maintained, and enhanced CRM and call center applications: Salesforce.com, Marketo, inContact, LivePerson, and DocuSign. Responsible for CRM roadmap, architecture, and delivery, as well as budget and resource allocation. Managed global team of project managers, developers, and administrators (team of 20). • Oversaw Lead to Quote, and Quote to Order processes and technologies • Responsible for RingCentral’s multi-lingual Customer Support website infrastructure, including knowledge base, Community, and case management. • Lead engagement between IT and various Business units (Sales, Sales Ops, Sales Finance, Finance, Biz Ops). Day-to-day tasks include gathering requirements from Business Partners, documenting existing processes, and improving them to increase scalability and efficiency. Pool resources across IT to architect, test, and implement new features on WebEx’s next generation SaaS billing platform. Received Employee of the Quarter Award in July 2011 for Salesforce.com integration efforts. • Salesforce.com Led data migration from previous CRM to Salesforce.com. Worked with Sales Operations to cleanse data and identify what customizations were needed; partnered with Salesforce.com development team to implement them. • Automate Cisco-WebEx Joint Orderability Worked with Order Management Team to identify the bottlenecks of the Cisco-WebEx ordering process. Collaborated with Cisco WebEx Go-To-Market and Architecture teams to develop a solution that would automate the manual order entry process. Consolidated numerous data sources into a single UI for OM Team to use. As a result of this automation project, order creation and approval that previously took 2 hours has been shortened to 20 minutes."
Uday Hegde,"CEO at USEReady, Governing Body Member IIITB, HBS Alumnus, Organization Builder I am an entrepreneur and investor based in USA. I am currently co-founder at USEReady, which is headquartered in New York. I believe in building businesses that carry the following values - Customer Centricity, Community, Continuous Improvement, Integrity and Humility. USEReady’s mission is to help users succeed with data. We achieve this mission with fanatical customer centricity, humility and integrity. At USEReady, we love to solve customer problems, contribute to community and continue to improve. We aim to build a strong learning culture and have fun doing it together. We have harnessed modern Business Intelligence solutions with cutting edge Artificial Intelligence (AI) platforms to unlock the power of data. Our result oriented solution ensures that our customers are successful in adopting self-service technologies. We have partnered with the best in class BI, Data and Cloud products such as Tableau, Snowflake, Alteryx, Informatica, Alation, Collibra, AWS and Microsoft. We have delivered proven success across Financial Services, Insurance, Retail and Media verticals. We have been nominated and won several awards along this journey. Check us out at www.useready.com Honors and Awards 2018 - Tableau Partner Advisory Council member 2017 - System Integrator of the year award by Tableau 2016 - Services Partner Of The Year 2015 By Tableau 2015 - INC5000 fastest growing company in US 2015 - Red Herring Top 100 North America CORDL's mission is to transform CA/CS/Tax Practitioners to be more productive, increase revenue, and spend more time with family. During my tenure at the bank, I was responsible for design and development of award winning Market Risk platform for the bank. I hired and managed a team of solution developers and business analysts globally. Built application for Performance, Attribution, Exposure and Investment Guideline calculation and monitoring Designed risk data mart leveraging Ralph Kimball principles of data warehousing Integrated market data, pricing and risk calculation engines from the market including Bloomberg, Risk Metrics, MSCI "
Udhay Shankar + Startups (2 about + JD),"I've been lucky. Lucky to have been involved in various interesting technologies as they were going non-linear, and lucky to have worked with these technologies -- including CAD, the internet, and wireless -- in wildly varying roles. I have startup, midsize and large company experience -- in roles ranging from marketing (which is what I'm probably best at); to business / technology strategy; and also to technical management and various other things that Had To Get Done.I love connecting people: to other people, and to ideas. I see myself as a strategy person, a big picture one. I exercise this set of muscles by helping out entrepreneurs in whatever way I can. Can I help you? Feel free to ask. Specialties: Emerging Markets, Business and Technology Strategy, New product discovery, enabling communication between technical and business teams, people networking! Mentor a few startups. Provide strategic inputs, introductions to potential customers and investors; and occasional operational assistance to marketing teams. The Goa Project <www.thegoaproject.com> is an unconference where you can interact with thinkers, doers, performers and visionaries - a 2-day explosion of ideas that breeds innovation and learning. I run a mailing list called silklist, devoted to interesting people and intelligent discourse. It has been in continuous existence since late 1997, which makes it one of the longer-lived email lists on the net. An archive can be seen at https://www.mail-archive.com/silklist@lists.hserus.net/ Discussions on silklist have ended up inspiring articles, books, Ph.D theses, and sociological studies. Axilor Ventures helps the early stage startup ecosystem in various ways, including seed funding, business acceleration, and follow-on funding. I set up and ran the accelerator program at Axilor, and built key partnerships with various players in the ecosystem. I work with a couple of groups at Intel to define new products and offerings for the Indian market. I help run innovation programs across all business units of Intel in India. I am also a member of the IDEA Factory Forum, an internal incubator that promotes and evaluates entrepreneurial ideas from employees for further development and potential go-to-market."
Ujwal Kalpavraksh + petrofac,"Management of multi-billion USD Proposals in the Oil & Gas Sector as Senior Manager - Proposals at Petrofac. Specialties: Project & Proposal Management including Planning & Control, Team Leading & Directing, Procurement & Contract Management, Cost Estimation. Team Leader for multi-billion dollar Proposals including Borouge 3 U&O, Borouge 3 XLPE, Masdar 100 MW Solar Power Plant (Abu Dhabi), Senoro Gas Development Project for Pertamina - Medco (Indonesia), KNPC CFP & NRP (Kuwait), ENOC Jebel Ali Rfinery Expansion (UAE), BAPCO Modernization Program (Bahrain) Project Manager for ""Primary Reformer Modification Package for 1000 MTPD Ammonia Plant"" at Rashtriya Chemicals & Fertilizers Ltd, Mumbai, India from Jun-05 to Jun-06 Project Coordinator for ""Fired Heaters for DHDT / HGU Plants"" at IOCL, Panipat, India from Jul-03 to May-05"
Varadharaj V (Vardha),"VP & Head - India Recruiting, Global Contingent Staffing. A seasoned global talent fulfillment professional, with a passion for HR, a transformation-change agent and a celebrated people manager. Infosys has become the second most valuable Indian brand, as named by the world’s leading brand valuation firm - Brand Finance. An increase of over 50% in our brand value over the last year, this is a testament of our strategic focus, purposeful growth and excellence in execution. Heading a large recruiting team in India which boasts of a near 60% gender ratio in favour of women I am so proud of the energy, maturity, innovation, passion and emotional intelligence that each one of you bring to work every single day. And the ownership you all show towards the deliverables and outcomes. Very grateful and super proud!! #womanpower #diversity #forwardwiithinfosys. Want to navigate the future of the tech industry and work with cutting-edge technologies? Then participate in #HackWithInfy, India today. Registrations open for B.E/B.Tech/M.E/M.Tech students graduating in the years 2023, 2024, and 2025. To read more about the HackWithInfy structure, Eligibility Criteria, Registration Process and FAQs- https://lnkd.in/gXhJb8FJ To register, please visit this link: https://lnkd.in/gc8czD7f. The last date to register for HackWithInfy 2022 is Monday, Feb 14, 2022."
Vasant Kumar + Vayu,"Have held a variety of engineering leadership positions over the course of a 30 year career. Currently the CEO of Vayu Technology Corp a biomedical, sports and healthcare technology company that specializes in building solutions for enhancing athletic performance, reducing injuries and expediting recovery. Also a strategic and technology advisor that include FitBliss a startup that focuses on corporate wellness, BoonVR that has built out a VR based training platform and Feathercap that is a AI based corporate learning management. Background includes engineering management roles at Oracle and pioneering roles in setting up one of the first software outsourcing factories in India. * Strategic leadership and general management skills. * Extensive senior engineering management experience and expertise. * Leadership of multi-functional teams. * Experience in building and growing top notch teams. * Several years of experience in offshore development. * Outstanding track record in taking ideas from conception to delivery very rapidly. Specialties: Strategic Leadership and Ability to grow teams and companies Software Engineering Management in a variety of areas"
